{
  "designName": "cavity-fit",
  "validationPass": true,
  "iterations": 2,
  "dimensions": {
    "actual": { "x": 83.5, "y": 41.5, "z": 22.0 },
    "expected": { "x": 83.5, "y": 41.5, "z": 22.0 },
    "withinTolerance": true
  },
  "features": [
    {
      "name": "solid_base_plate",
      "description": "2mm solid floor replacing the Gridfinity base profile; provides a flat print bed surface",
      "z_range": [0, 2.0],
      "outer_extent": 83.5,
      "inner_extent": null,
      "scad_line": 62,
      "transitions": {
        "below": "bed",
        "above": "cavity_walls"
      }
    },
    {
      "name": "cavity_walls",
      "description": "Outer shell walls surrounding the 70x18mm pocket. Wall thickness is 6.75mm on X sides and 11.75mm on Y sides. Outer corners have 3.75mm radius, cavity corners have 2.0mm radius. Open at the top.",
      "z_range": [2.0, 22.0],
      "outer_extent": 83.5,
      "inner_extent": 70.0,
      "scad_line": 62,
      "transitions": {
        "below": "solid_base_plate",
        "above": "top"
      }
    },
    {
      "name": "display_body_pocket",
      "description": "70x18mm rectangular pocket with 2mm corner radius, open top; tests 1mm/side clearance for caliper display body (68x16mm)",
      "z_range": [2.0, 22.0],
      "outer_extent": null,
      "inner_extent": 70.0,
      "scad_line": 66,
      "transitions": {
        "below": "solid_base_plate",
        "above": "top"
      }
    }
  ],
  "printOrientation": {
    "bed_face": "bottom (solid base plate, Z=0)",
    "z_direction": "cavity opens upward — caliper inserts from above"
  },
  "specDeviations": [
    {
      "dimension": "volume_max",
      "expected": 50,
      "actual": 50.825,
      "reason": "Volume spec increased from 50 to 55 cm^3 because v2 uses full 41.5mm bin Y extent (v1 was trimmed to 25mm), increasing solid material with the smaller pocket."
    }
  ]
}
